{
  "schema_version": "3.0",
  "registry_id": "kristal:authority-registry:sha256:9f2c0c7a6a1e7b3a5d4a9c3d5b7f1e2a9c4d6e8f0a1b2c3d4e5f6a7b8c9d0e1f",
  "created_at": "2026-02-26T18:05:07Z",
  "canonicalization_profile": "kristal.v3:jcs-rfc8785",
  "canonicalization_version": "1",
  "content_hash": {
    "alg": "sha256",
    "value": "0f4b2a3c9d8e7f60123456789abcdef0123456789abcdef0123456789abcdef0"
  },
  "trust_roots": {
    "active_roots": [
      {
        "root_id": "did:web:untrust.example",
        "category": "recognized",
        "label": "UNTrust Root (example)",
        "did": "did:web:untrust.example"
      },
      {
        "root_id": "kristal:key:org-heritage-signing-1",
        "category": "recognized",
        "label": "Heritage Org Signing Key v1",
        "key_id": "kristal:key:org-heritage-signing-1",
        "public_key_jwk": {
          "kty": "OKP",
          "crv": "Ed25519",
          "x": "11qYAY7k3YhF6vO0DqX3v3l3l3l3l3l3l3l3l3l3l3k"
        },
        "not_before": "2026-01-01T00:00:00Z",
        "not_after": "2028-01-01T00:00:00Z"
      }
    ],
    "deprecated_roots": [
      {
        "root_id": "kristal:key:org-heritage-signing-0",
        "category": "recognized",
        "label": "Heritage Org Signing Key v0 (deprecated)",
        "key_id": "kristal:key:org-heritage-signing-0",
        "public_key_jwk": {
          "kty": "OKP",
          "crv": "Ed25519",
          "x": "hJtXIZ2uSN5kbQfbtTNWbg1Q3kqf2t2t2t2t2t2t2t2t2t2t2t2s"
        },
        "not_before": "2024-01-01T00:00:00Z",
        "not_after": "2026-12-31T23:59:59Z"
      }
    ],
    "blocked_roots": [
      {
        "root_id": "did:web:bad-actor.example",
        "category": "personal",
        "label": "Blocked bad actor root",
        "did": "did:web:bad-actor.example"
      }
    ]
  },
  "revocation_list": {
    "artifact_path": "revocations.json",
    "content_hash": {
      "alg": "sha256",
      "value": "aaaaaaaaaaaaaaaaaaaaaaaaaaaaaaaaaaaaaaaaaaaaaaaaaaaaaaaaaaaaaaaa"
    },
    "signatures": [
      {
        "key_id": "kristal:key:org-heritage-signing-1",
        "alg": "ed25519",
        "signature": "MEUCIQDv7v7v7v7v7v7v7v7v7v7v7v7v7v7v7v7v7v7v7v7v7v7v7w==",
        "created_at": "2026-02-26T18:05:07Z"
      }
    ]
  },
  "rules": [
    {
      "rule_id": "rule-heritage-only-recognized",
      "scope": {
        "domain": "heritage"
      },
      "allowed_root_categories": ["recognized"],
      "allowed_root_ids": [
        "did:web:untrust.example",
        "kristal:key:org-heritage-signing-1"
      ],
      "required_profiles": [
        "kristal.v3:validation-core@1",
        "kristal.v3:export-rdfc@1"
      ],
      "min_signatures": 1,
      "revocation_policy": "require_if_present"
    },
    {
      "rule_id": "rule-education-personal-ok",
      "scope": {
        "domain": "education",
        "subdomain": "open-content"
      },
      "allowed_root_categories": ["personal", "recognized"],
      "required_profiles": ["kristal.v3:validation-core@1"],
      "min_signatures": 1,
      "revocation_policy": "require_if_present"
    }
  ],
  "signatures": [
    {
      "key_id": "kristal:key:org-heritage-signing-1",
      "alg": "ed25519",
      "signature": "MEUCIQCS7u7u7u7u7u7u7u7u7u7u7u7u7u7u7u7u7u7u7u7u7u7u7g==",
      "created_at": "2026-02-26T18:05:07Z"
    }
  ]
}